SET @@GLOBAL.TIDB_ENABLE_VECTOR_TYPE = 1;

-- Create a table with VECTOR type column and enable TiFlash replica.
DROP TABLE IF EXISTS t;
CREATE TABLE t (embedding VECTOR);
ALTER TABLE t SET TIFLASH REPLICA 1;
SELECT SLEEP(60);
SLEEP(60)
0

-- Check if the TiFlash replica is available.
SELECT AVAILABLE, PROGRESS FROM INFORMATION_SCHEMA.TIFLASH_REPLICA WHERE TABLE_SCHEMA = DATABASE() AND TABLE_NAME IN ('t') ORDER BY TABLE_NAME;
AVAILABLE	PROGRESS
1	1

-- Test statement: INSERT

INSERT INTO t VALUES (VEC_FROM_TEXT('[1,2.1,3.3]'));
INSERT INTO t VALUES ('[1,2.1,null]');
Error 1105 (HY000): Invalid vector text: [1,2.1,null]
INSERT INTO t VALUES ('[1,2.1,inf]');
Error 1105 (HY000): Invalid vector text: [1,2.1,inf]
INSERT INTO t VALUES ('[1,2.1,nan]');
Error 1105 (HY000): Invalid vector text: [1,2.1,nan]
INSERT INTO t VALUES ('[]');
INSERT INTO t VALUES (NULL);

INSERT INTO t VALUES ('[4,5,6]'), ('[7,8,9]');

-- Test statement:  INSERT ... SELECT ...
CREATE TABLE tmp (embedding VECTOR);
INSERT INTO tmp SELECT embedding FROM t;
SELECT embedding FROM tmp ORDER BY embedding;
embedding
NULL
[]
[1,2.1,3.3]
[4,5,6]
[7,8,9]
DROP TABLE tmp;

-- Test statement: UPDATE

UPDATE t SET embedding = VEC_FROM_TEXT('[1,2,3]') WHERE embedding = VEC_FROM_TEXT('[1,2.1,3.3]');

BEGIN;
SELECT * FROM t WHERE embedding = VEC_FROM_TEXT('[]') FOR UPDATE;
embedding
[]
UPDATE t SET embedding = NULL WHERE embedding = VEC_FROM_TEXT('[]');
COMMIT;

-- Test statement: DELETE

DELETE FROM t WHERE embedding IS NULL;

-- Analyze table

ANALYZE TABLE t;

-- Test statement: SELECT

SELECT /*+ READ_FROM_STORAGE(TIKV[t]) */ * FROM t;
embedding
[1,2,3]
[4,5,6]
[7,8,9]
EXPLAIN FORMAT='brief' SELECT /*+ READ_FROM_STORAGE(TIKV[t]) */ * FROM t;
id	estRows	task	access object	operator info
TableReader	3.00	root		data:TableFullScan
└─TableFullScan	3.00	cop[tikv]	table:t	keep order:false

SELECT /*+ READ_FROM_STORAGE(TIFLASH[t]) */ * FROM t;
embedding
[1,2,3]
[4,5,6]
[7,8,9]
EXPLAIN FORMAT='brief' SELECT /*+ READ_FROM_STORAGE(TIFLASH[t]) */ * FROM t;
id	estRows	task	access object	operator info
TableReader	3.00	root		MppVersion: 1, data:ExchangeSender
└─ExchangeSender	3.00	mpp[tiflash]		ExchangeType: PassThrough
  └─TableFullScan	3.00	mpp[tiflash]	table:t	keep order:false

-- Prepare test data

DELETE FROM t WHERE 1 = 1;
INSERT INTO t VALUES ('[1,2,3]'), ('[4,5,6]'), ('[7,8,9]'), (NULL), ('[]');

-- Test clause: WHERE

SELECT /*+ READ_FROM_STORAGE(TIKV[t]) */ * FROM t WHERE embedding IS NULL;
embedding
NULL

SELECT /*+ READ_FROM_STORAGE(TIFLASH[t]) */ * FROM t WHERE embedding IS NULL;
embedding
NULL

SELECT /*+ READ_FROM_STORAGE(TIKV[t]) */ * FROM t WHERE embedding = '[]';
embedding
[]

SELECT /*+ READ_FROM_STORAGE(TIFLASH[t]) */ * FROM t WHERE embedding = '[]';
embedding
[]

SELECT /*+ READ_FROM_STORAGE(TIKV[t]) */ * FROM t WHERE embedding = VEC_FROM_TEXT('[1,2,3]');
embedding
[1,2,3]

SELECT /*+ READ_FROM_STORAGE(TIFLASH[t]) */ * FROM t WHERE embedding = VEC_FROM_TEXT('[1,2,3]');
embedding
[1,2,3]

-- Prepare test data
DELETE FROM t WHERE 1 = 1;
INSERT INTO t VALUES ('[1,2,3]'), ('[4,5,6]'), ('[7,8,9]');

-- Test operator: BETWEEN ... AND ...

SELECT /*+ READ_FROM_STORAGE(TIKV[t]) */ * FROM t WHERE embedding BETWEEN '[1,2,3]' AND '[4,5,6]';
embedding
[1,2,3]
[4,5,6]

SELECT /*+ READ_FROM_STORAGE(TIFLASH[t]) */ * FROM t WHERE embedding BETWEEN '[1,2,3]' AND '[4,5,6]';
embedding
[1,2,3]
[4,5,6]

-- Test operator: IN / NOT IN

SELECT /*+ READ_FROM_STORAGE(TIKV[t]) */ * FROM t WHERE embedding IN ('[1,2,3]', '[4,5,6]');
embedding
[1,2,3]
[4,5,6]

SELECT /*+ READ_FROM_STORAGE(TIFLASH[t]) */ * FROM t WHERE embedding IN ('[1,2,3]', '[4,5,6]');
embedding
[1,2,3]
[4,5,6]

-- Test operator: LIKE

SELECT /*+ READ_FROM_STORAGE(TIKV[t]) */ * FROM t WHERE embedding LIKE '%2%';
embedding
[1,2,3]

SELECT /*+ READ_FROM_STORAGE(TIFLASH[t]) */ * FROM t WHERE embedding LIKE '%2%';
embedding
[1,2,3]

-- Test operator: ILIKE

SELECT /*+ READ_FROM_STORAGE(TIKV[t]) */ * FROM t WHERE embedding ILIKE '%2%';
embedding
[1,2,3]

SELECT /*+ READ_FROM_STORAGE(TIFLASH[t]) */ * FROM t WHERE embedding ILIKE '%2%';
embedding
[1,2,3]

-- Test clause: HAVING

SELECT /*+ READ_FROM_STORAGE(TIKV[t]) */ embedding FROM t GROUP BY embedding HAVING embedding > VEC_FROM_TEXT('[4,5,6]') ORDER BY embedding;
embedding
[7,8,9]

SELECT /*+ READ_FROM_STORAGE(TIFLASH[t]) */ embedding FROM t GROUP BY embedding HAVING embedding > VEC_FROM_TEXT('[4,5,6]') ORDER BY embedding;
embedding
[7,8,9]

-- Test clause: ORDER BY

SELECT /*+ READ_FROM_STORAGE(TIKV[t]) */ * FROM t ORDER BY embedding DESC;
embedding
[7,8,9]
[4,5,6]
[1,2,3]

SELECT /*+ READ_FROM_STORAGE(TIFLASH[t]) */ * FROM t ORDER BY embedding DESC;
embedding
[7,8,9]
[4,5,6]
[1,2,3]

-- Test feature: Prepared Statement

PREPARE stmt FROM 'SELECT * FROM t WHERE embedding = ?';
SET @a = VEC_FROM_TEXT('[1,2,3]');
EXECUTE stmt USING @a;
embedding
[1,2,3]
DEALLOCATE PREPARE stmt;
